标题,标题链接,图片,字段
Where do I start?,https://www.ox.ac.uk/admissions/graduate/applying-to-oxford/getting-started,https://www.ox.ac.uk/sites/files/oxford/styles/ow_listing/s3/field/field_image_main/Lady%20Margaret%20Hall%20%28Rob%20Judges%29.jpg?itok=VRuGmGgq,"If you're considering applying for graduate study at Oxford, our step-by-step guide will help you get started. "
Application Guide,https://www.ox.ac.uk/admissions/graduate/applying-to-oxford/application-guide,https://www.ox.ac.uk/sites/files/oxford/styles/ow_listing/s3/field/field_image_main/Zhoudan%20Pan%2C%20IEB%20sunset%201%20%28cropped%29.jpg?itok=-HlkudW0,"Follow our detailed instructions to prepare, complete and submit your application."
Applicants with disabilities,https://www.ox.ac.uk/admissions/graduate/applying-to-oxford/applicants-with-disabilities,https://www.ox.ac.uk/sites/files/oxford/styles/ow_listing/s3/field/field_image_main/Rujing%20Guo%2C%20Somerville%20College%20in%20Autumn%20%28cropped%29.jpg?itok=R6pUIzyq,Advice and further resources to support applications from people with disabilities.
Applying for a master's degree,,,Watch our video about master's study to hear advice from Oxford students.
Applying for a DPhil,,,Watch our video about DPhil study to hear advice from Oxford students.
Information for referees,https://www.ox.ac.uk/admissions/graduate/applying-to-oxford/information-for-referees,https://www.ox.ac.uk/sites/files/oxford/styles/ow_listing/s3/field/field_image_main/Yusuf%20Bahasoan%2C%20Clarendon%20Building.jpg?itok=-fq8nqk7,Instructions and advice on how to submit a reference for a graduate application.